{
  "$schema": "http://json-schema.org/draft-07/schema#",
  "$id": "https://bible-app.local/schemas/extension-manifest-v1.json",
  "title": "Bible Desktop Extension Manifest (v1)",
  "description": "Schema for extension.json, provided as an authoring aid for editors (autocomplete/validation in IDEs). It is NOT loaded or enforced by the manifest loader at runtime - the sole runtime gate is the hand-written validateManifest() in ExtensionManifestValidator.ts, wrapped by apps/desktop/electron/extensions/ExtensionManifestLoader.ts. The two must be kept in sync by hand; see packages/core/src/Extensions/ExtensionManifest.ts for the matching TypeScript shape.",
  "type": "object",
  "required": ["id", "name", "version", "publisher", "engines"],
  "additionalProperties": false,
  "properties": {
    "$schema": { "type": "string" },

    "id": {
      "type": "string",
      "description": "ext.<publisher>.<name> - kebab-case labels separated by dots.",
      "pattern": "^ext\\.[a-z0-9]+(?:-[a-z0-9]+)*\\.[a-z0-9]+(?:-[a-z0-9]+)*$"
    },
    "name": { "$ref": "#/definitions/LocalizedString" },
    "displayName": { "$ref": "#/definitions/LocalizedString" },
    "version": {
      "type": "string",
      "description": "Semver version of the extension package.",
      "pattern": "^\\d+\\.\\d+\\.\\d+(?:-[0-9A-Za-z.-]+)?(?:\\+[0-9A-Za-z.-]+)?$"
    },
    "publisher": {
      "type": "string",
      "pattern": "^[a-z0-9]+(?:-[a-z0-9]+)*$"
    },
    "description": { "$ref": "#/definitions/LocalizedString" },

    "categories": {
      "type": "array",
      "items": { "type": "string" },
      "uniqueItems": true
    },
    "keywords": {
      "type": "array",
      "items": { "type": "string" },
      "uniqueItems": true
    },
    "homepage": { "type": "string", "format": "uri" },
    "repository": { "type": "string", "format": "uri" },
    "bugs": { "type": "string", "format": "uri" },
    "license": { "type": "string" },
    "pricing": {
      "type": "string",
      "enum": ["free", "freemium", "paid"]
    },
    "icon": { "type": "string" },
    "preview": { "type": "boolean" },

    "engines": {
      "type": "object",
      "required": ["bibleApp"],
      "additionalProperties": false,
      "properties": {
        "bibleApp": {
          "type": "string",
          "description": "Semver range against EXTENSION_API_VERSION."
        }
      }
    },

    "main": { "type": "string" },

    "permissions": {
      "type": "array",
      "uniqueItems": true,
      "items": { "$ref": "#/definitions/Permission" }
    },

    "network": {
      "type": "object",
      "required": ["allowedHosts"],
      "additionalProperties": false,
      "properties": {
        "allowedHosts": {
          "type": "array",
          "minItems": 1,
          "items": { "$ref": "#/definitions/AllowedHost" }
        }
      }
    },

    "privacy": {
      "type": "object",
      "required": ["dataCollection"],
      "additionalProperties": false,
      "description": "Privacy declaration - what data the extension collects and sends to its backend.",
      "properties": {
        "dataCollection": {
          "type": "array",
          "minItems": 1,
          "uniqueItems": true,
          "items": {
            "type": "string",
            "enum": ["analytics", "crash-reports", "user-content", "personalization", "none"]
          }
        },
        "privacyPolicyUrl": {
          "type": "string",
          "format": "uri"
        }
      }
    },

    "webviews": {
      "type": "object",
      "additionalProperties": false,
      "properties": {
        "csp": {
          "type": "object",
          "additionalProperties": false,
          "properties": {
            "img-src":     { "$ref": "#/definitions/CspSourceList" },
            "font-src":    { "$ref": "#/definitions/CspSourceList" },
            "style-src":   { "$ref": "#/definitions/CspSourceList" },
            "connect-src": { "$ref": "#/definitions/CspSourceList" },
            "media-src":   { "$ref": "#/definitions/CspSourceList" },
            "frame-src":   { "$ref": "#/definitions/CspSourceList" }
          }
        }
      }
    },

    "activationEvents": {
      "type": "array",
      "description": "When to activate this extension. See packages/core/src/Extensions/ActivationEvents.ts for the full vocabulary (e.g. 'onStartupFinished', 'onCommand:<id>', 'onView:<panelTypeId>'). This schema does not enumerate the vocabulary itself - ExtensionManifestValidator.ts is the runtime authority and rejects anything outside it.",
      "items": { "type": "string", "minLength": 1 },
      "uniqueItems": true
    },

    "contributes": {
      "type": "object",
      "additionalProperties": false,
      "properties": {
        "commands": {
          "type": "array",
          "items": { "$ref": "#/definitions/ContributedCommand" }
        },
        "panelTypes": {
          "type": "array",
          "items": { "$ref": "#/definitions/PanelTypeDef" }
        },
        "configuration": {
          "oneOf": [
            {
              "type": "object",
              "required": ["$ref"],
              "additionalProperties": false,
              "properties": { "$ref": { "type": "string" } }
            },
            { "type": "object" }
          ]
        },
        "apiExports": {
          "type": "array",
          "items": { "$ref": "#/definitions/ContributedApiExport" }
        },
        "bibleProviders": {
          "type": "array",
          "items": { "$ref": "#/definitions/BibleProviderDescriptor" }
        }
      }
    },

    "runtime": {
      "type": "object",
      "additionalProperties": false,
      "properties": {
        "maxMemoryMB": {
          "type": "integer",
          "minimum": 256,
          "maximum": 1024,
          "description": "Maximum V8 heap size in MB for the worker process. Clamped to 256-1024 MB. Default 256."
        }
      }
    },

    "l10n": { "type": "string" },

    "userData": {
      "type": "object",
      "additionalProperties": false,
      "description": "Which of the extension's data is the user's and belongs in a backup. The key-value store is included unless `backup` is false; a database is included only when declared with `backup: true`. Secrets are never included.",
      "properties": {
        "backup": { "type": "boolean", "description": "Include the key-value store in backups. Default true." },
        "sync": { "type": "boolean", "description": "Reserved for a future version." },
        "databases": {
          "type": "object",
          "propertyNames": { "pattern": "^[A-Za-z0-9][A-Za-z0-9_-]{0,63}$" },
          "additionalProperties": {
            "type": "object",
            "additionalProperties": false,
            "properties": {
              "backup": { "type": "boolean" },
              "sync": { "type": "boolean" }
            }
          }
        }
      }
    },

    "uiKit": {
      "type": "object",
      "additionalProperties": false,
      "required": ["version", "components"],
      "description": "Opt-in to the host-served UI kit (kth-* custom elements) for panels. Requires the `ui:contribute-pane` permission. Unknown versions or component tags are rejected at install.",
      "properties": {
        "version": { "type": "string", "enum": ["1"], "description": "UI kit major version." },
        "components": {
          "type": "array",
          "uniqueItems": true,
          "items": { "type": "string", "enum": ["kth-book-chapter-picker", "kth-reference-picker", "kth-highlight-swatch"] },
          "description": "Component tags the panel intends to use."
        }
      }
    }
  },

  "definitions": {
    "LocalizedString": {
      "oneOf": [
        { "type": "string" },
        {
          "type": "object",
          "required": ["key"],
          "additionalProperties": false,
          "properties": {
            "key": { "type": "string" },
            "params": { "type": "object" }
          }
        }
      ]
    },

    "Permission": {
      "type": "string",
      "enum": [
        "bible:read",
        "commentary:read",
        "dictionary:read",
        "book:read",
        "notes:read",
        "notes:write",
        "highlights:read",
        "highlights:write",
        "bookmarks:read",
        "bookmarks:write",
        "bible:provide",
        "commentary:provide",
        "dictionary:provide",
        "book:provide",
        "storage",
        "storage:secrets",
        "storage:database",
        "ui:contribute-pane",
        "ui:verse-decorator",
        "ui:verse-hover",
        "ui:context-menu",
        "ui:notification",
        "ui:status-bar",
        "ui:media",
        "commands:register",
        "commands:execute-builtin",
        "tasks",
        "network",
        "network:oauth",
        "speech:listen",
        "speech:speak",
        "extensions:call",
        "fs:read-user",
        "fs:write-user",
        "fs:managed-folder"
      ]
    },

    "AllowedHost": {
      "type": "object",
      "required": ["host", "purpose"],
      "additionalProperties": false,
      "properties": {
        "host": {
          "type": "string",
          "minLength": 1,
          "description": "Hostname or *.subdomain wildcard. Wildcards match one or more labels."
        },
        "purpose": { "$ref": "#/definitions/LocalizedString" },
        "methods": {
          "type": "array",
          "uniqueItems": true,
          "items": {
            "type": "string",
            "enum": ["GET", "POST", "PUT", "PATCH", "DELETE", "HEAD"]
          }
        }
      }
    },

    "CspSourceList": {
      "type": "array",
      "items": { "type": "string" },
      "uniqueItems": true
    },

    "KeybindingDescriptor": {
      "type": "object",
      "required": ["key"],
      "additionalProperties": false,
      "properties": {
        "key": { "type": "string" },
        "mac": { "type": "string" },
        "when": { "type": "string" }
      }
    },

    "Shortcut": {
      "oneOf": [
        { "$ref": "#/definitions/KeybindingDescriptor" },
        {
          "type": "array",
          "items": { "$ref": "#/definitions/KeybindingDescriptor" }
        }
      ]
    },

    "ContributedCommand": {
      "type": "object",
      "required": ["id", "title"],
      "additionalProperties": false,
      "properties": {
        "id": { "type": "string", "minLength": 1 },
        "title": { "$ref": "#/definitions/LocalizedString" },
        "category": { "$ref": "#/definitions/LocalizedString" },
        "shortcut": { "$ref": "#/definitions/Shortcut" },
        "when": { "type": "string" },
        "handlerEndpoint": { "type": "string" },
        "order": { "type": "integer" },
        "hidden": { "type": "boolean" }
      }
    },

    "PanelTypeDef": {
      "type": "object",
      "required": ["id", "title", "uiEntry"],
      "additionalProperties": false,
      "properties": {
        "id": { "type": "string", "minLength": 1 },
        "title": { "$ref": "#/definitions/LocalizedString" },
        "icon": { "type": "string" },
        "uiEntry": { "type": "string" },
        "defaultBucket": {
          "type": "string",
          "enum": ["left", "right", "bottom", "unknown"]
        },
        "writingPane": { "type": "boolean" }
      }
    },

    "ContributedApiExport": {
      "type": "object",
      "required": ["method", "handlerEndpoint"],
      "additionalProperties": false,
      "properties": {
        "method": {
          "type": "string",
          "pattern": "^[A-Za-z_$][A-Za-z0-9_$]*$"
        },
        "description": { "$ref": "#/definitions/LocalizedString" },
        "handlerEndpoint": { "type": "string" }
      }
    },

    "Capability": {
      "type": "string"
    },

    "BibleProviderDescriptor": {
      "type": "object",
      "required": ["id", "name", "abbreviation", "capabilities", "fetchEndpoint"],
      "additionalProperties": false,
      "properties": {
        "id": { "type": "string" },
        "name": { "$ref": "#/definitions/LocalizedString" },
        "abbreviation": { "type": "string" },
        "language": { "type": "string" },
        "capabilities": {
          "type": "array",
          "items": {
            "type": "string",
            "enum": ["lookup", "range", "iterate", "remote"]
          }
        },
        "fetchEndpoint": { "type": "string" },
        "rangeEndpoint": { "type": "string" },
        "iterateEndpoint": { "type": "string" }
      }
    }
  }
}
