{
  "id": "ext.test.asarprobe",
  "name": "Asar Probe Extension",
  "version": "1.0.0",
  "publisher": "bible-app",
  "description": "E2E fixture that proves the extension worker (utilityProcess) actually spawned and executed the extension-runtime bundle from inside app.asar.",
  "engines": { "bibleApp": "^0.2.0" },
  "main": "./main.js",
  "permissions": ["storage"],
  "activationEvents": ["onStartupFinished"]
}
